tweet_text,cyberbullying_type,is_targeting_women,needs_review,sentiment_score,is_hostile_to_women,is_hostile_needs_review
@Lil_Mike_12: Fuck twerking bitch can you cook ?,gender,True,False,-0.8074,True,False
Here comes this bad bitch with the worst hair cut and vocabulary on earth. @TheWalkingDead,gender,True,False,-0.934,True,False
Decided to give Chozen a shot since it was right after Archer. So far the gay rape joke count is about 0.7 per minute.,gender,True,False,-0.5423,True,False
"Resign today Al. It will only get worse from here Al. Raping Leslie Stahl jokes? Rape isn’t a joke. Drugging Leslie Stahl and positioning her? Sick Al, wierd and sick. Hating gays, being happy one was murdered? You remain a senator and the dems never regain cred. You are a pig.",gender,True,False,-0.9748,True,False
You know what else is hateful and sick? A sitting republican congressman who serves on the board of a Christian charity calling a female colleague a fucking bitch and his party remaining silent but then on guy call your wife a dog and you lick his boots.,gender,True,False,-0.4672,True,False
"@EnaLolena @Roostrwoodstock Oh look, another lying Putin paid internet propaganda bitch. http://t.co/1njm6SN8K5",gender,True,False,-0.8481,True,False
"Like that’s the part that confuses me. In what world is that ok at work?!? Athough, a female coworker did call me a bitch in an email and we had it out in the office once.",gender,True,False,-0.4682,True,False
Would you say the same if he made a rape joke? Mocked a disability? Gay bashed? Are you cool with all hate speech? Or just this term?,gender,True,False,-0.8466,True,False
"RT @lahellraiser call me sexist if you want, but I find female sportscasters really annoying.",gender,True,False,-0.5913,True,False
Here's my issue with people like the gay TV producer-- he wouldn't be saying relax if a Scott Baio had made the same stupid joke. #Kimmel shouldn't be given a pass because he is a liberal. That's why @TheDemocrats ignored Clinton's RAPE of #JuanitaBroaddrick &amp; it's unacceptable.,gender,True,False,-0.9159,True,False
Self-awareness at critically low levels @YouknowitsDoug im not sexist but some bitches are dumb,gender,True,False,-0.9072,True,False
"I wonder how many people outraged by the Netflix show about a gay Jesus think jokes about rape and sexual harassment is ""dark humour"" and satire and women should just laugh and get over it If you're one of them, I hope you can finally see your hypocrisy and stupidity.",gender,True,False,-0.6124,True,False
Kat you stupid bitch  #mkr,gender,True,False,-0.802,True,False
from the Calvary Church by Wendy's while they have been making gay rape preacher child molestor jokes since I saw the movies years ago still)/another Louis Fowler impersonator and what looked like the Real Louis Fowler at the hotel lately using the same truck and has switched,gender,True,False,-0.296,True,False
"@TedYoho NO MORAL COMPASS IN REPUBLICAN PARTY? NO MORAL COMPASS IN YOUR REPUBLICAN FLORIDA PARTY. DID YOUR MAMA AND DADDY TEACH YOU TO CALL WOMEN YOU DISAGREE WITH ""BITCH"" FEMALE DOG. DID YOUR DADDY CALL YOUR MAMA ""BITCH""? WAS IT AT YOUR DADDYS FEET YOU LEARNED THIS. WWJD",gender,True,False,-0.9146,True,False
"OK, but the pill idea is a neutral to positive idea in a fantasy, and the misinterpretation came later. Fatshaming, slut-shaming, statutory rape, false sexual assault accusations, gay, racist, classist jokes, and general bitches be crazy shit were in this from the very beginning",gender,True,False,-0.9836,True,False
"@OfficMattPenny @IrkMeIngram Ah, I see. Men ""raise their voices."" Women ""scream.""",gender,True,False,-0.4019,True,False
RT @Millhouse66 @Maureen_JS nooo not sexist but most women are bad drivers,gender,True,False,-0.7307,True,False
"#scottbrown - against women's right to choose. Against gay rights. Basically a homophobeic, racist, sexist willing to even rape his opponent",gender,True,False,-0.8658,True,False
"It's weird seeing guys joke around about gay stuff, like ass rape &amp; sucking the d. I'm at the age where I'm thinking you're serious. #stop",gender,True,False,-0.8271,True,False
Females will call you friendly for liking girls pictures but you see her under the picture “ Twin” bitch you think she fine too,gender,True,False,-0.2617,True,False
"Hey @rosemcgowan why not fight a real enemy like islams treatment of women? Oh that's right ,would require a spine. Talentless twat feminazi",gender,True,False,-0.7793,True,False
Kats face. I want to slap her seriously I hope they go but it doesn't look good. If they pass they won't last. They can't cook. #mkr,gender,True,False,-0.2638,True,False
RT @SClowers6: I'm not sexist but I don't agree with women on sports shows that talk solely about men's sports.,gender,True,False,-0.395,True,False
"Exactly! Or what if a woman was hitting on a gay dude and he refused, does that make him sexist? They need to understand that is rape apologist rhetoric.",gender,True,False,-0.8016,True,False
@Dommoneek: Little stupid as bitch I don't fuck with yoooooouuuu..,gender,True,False,-0.585,True,False
No one tells girls to shave. No one said being gay is a choice. Rape is funny to joke about. Feminism is stupid.,gender,True,False,-0.8126,True,False
"I've learned at school that twelve year olds use gay as an insult, call boys girls as a joke and as an insult, and make rape jokes",gender,True,False,-0.8442,True,False
 i'd say im back to the old me but my old bitches would get excited  &#128524;,gender,True,False,-0.5023,True,False
"@Ryon_J_Cobb @scratch_paper And you are aware that gay people can also gay bash and that women can also be sexist, right? A rape victim...",gender,True,False,-0.7783,True,False
"I have a whole think piece of gay jokes and I've been on the receiving end of some real weird shit. I can only speak on rape in the sense of a bad relationship where saying no feels weird, so if you don't mind me speaking about that topic with that caveat then I'm willing to talk",gender,True,False,-0.9214,True,False
"@JaffaRef ""Women's sports are dumb"" --&gt; ""I won't pay to watch women's sports"" --&gt; ""why do women get paid $ if no one is watching them?""",gender,True,False,-0.6374,True,False
Will there be gay panic and tone deaf rape jokes? Cause that's so hot right now.,gender,True,False,-0.7906,True,False
@idontknowaaronn how can you be laughing you evil bitch,gender,True,False,-0.7184,True,False
Mfs will go into anaphylactic shock if you say boys instead of men. But will call you a bitch if you say they should say women instead of females. Is it crack?,gender,True,False,-0.7906,True,False
"A black guy, a gay guy, a depressed man, and a Christian went into a bar. And they just stayed there. There is no punchline because race, SOGIE, mental health, religion, and many others including rape should not be a subject of jokes.",gender,True,False,-0.8481,True,False
Bye bye bitches. Your ego might go down a notch now.  #mkr,gender,True,False,-0.5994,True,False
"“@8LTaylor “@____GTFO @8LTaylor lmfaooooo you done pissed this hoe off, she mad. Smh bully.”” hold on who a hoe?",gender,True,False,-0.8658,True,False
RT @J_Halas34: People call me sexist for my opinion on females &amp; professional sports.. Stop being so politically correct.,gender,True,False,-0.296,True,False
"Fucking faggots! Fuck boys! All y'all niggas that joke about rape, slander women and gays...Gotta die!",gender,True,False,-0.9635,True,False
I call both genders bitches you dumb bitch. That was the female bitch i called you btw,gender,True,False,-0.9413,True,False
"@vxssel he said that lesbians choose to be gay, told a fellow houseguest to kill herself and also made rape jokes on cAMERA",gender,True,False,-0.8555,True,False
"the world is really full of toxic ppl. There’s someone who make a joke about being RAPE. And he said its fine because he’s a guy? BRUH GIRL,BOY,LESBIAN, OR GAY WHAT EVER YOU ARE ITS NEVER ACCEPTABLE TO MAKE A JOKE ABOUT RAPE.",gender,True,False,-0.8569,True,False
Yea that sounds just as bad as rape. You sound just as outraged about jokes that we do about rape. How about you slow allllll the way down. I don’t see anybody coming for Will Ferrel. Go watch Anchor man go watch weeding crashers. That’s 2000’s. Plenty of gay jokes.,gender,True,False,-0.9371,True,False
Why is it that the worst insult to call a man always a female slur? Bitch. Pussy. No balls. I get it. Women are the worst. Now fuck all the way off.,gender,True,False,-0.9682,True,False
We don’t call females bitches now bc females dogs are loyal,gender,True,False,-0.2023,True,False
"RT @jcantrell12: For the record, I'm not sexist. But if you can prove me wrong about female comedians, I'll make a formal apology to the wo…",gender,True,False,-0.2617,True,False
I didn't say its okay to call female colleagues fucking bitches. I just said that those bitches shouldn't complain about it. -Archie,gender,True,False,-0.8248,True,False
"The Miseducation of the American Boy by ⁦@peggyorenstein⁩ “Why boys crack up at rape jokes, think having a girlfriend is “gay,” and still can’t cry—and why we need to give them new and better models of masculinity. “ cc ⁦@GoodMenProject⁩ https://www.theatlantic.com/magazine/archive/2020/01/the-miseducation-of-the-american-boy/603046/",gender,True,True,-0.2023,True,True
They make rape jokes and call eachother gay,gender,True,False,-0.5719,True,False
@mykitchenrules The Sassy Foods feeling http://t.co/TtqS1N27OL #MKR2015 #MKR these girls are vile people #KillerBlondes #basichotdog #nobun,gender,True,False,-0.5574,True,False
RT @nikeenan: @YesYoureSexist  your face isn't a excuse you self righteous son of a bitch. oh and don't worry I wasn't referring to your mo…,gender,True,False,-0.3851,True,False
"“@ReIgN_CoCo: It Takes A Peanut Size Brain To Find Humor In calling Somebody Ugly, Gay,Hoe And On Rape Jokes!Honestly!!!”",gender,True,False,-0.8429,True,False
RT @DejaCQQ99: Someone please buy Nelle a one way ticket and put her annoying ass on a train... #GH,gender,True,False,-0.5994,True,False
"Why boys crack up at rape jokes, think having a girlfriend is “gay,” and still can’t cry—and why we need to give them new and better models of masculinity. Toxic Masculinity and the Brokenness of Boyhood - The Atlantic - ⁦@peggyorenstein⁩ https://www.theatlantic.com/magazine/archive/2020/01/the-miseducation-of-the-american-boy/603046/",gender,True,True,-0.2023,True,True
Bendis made ultimate Spidey AND PETE'S CHARACTER DEVELOPMENT LITTERALY HAPPENED BEFORE HE DIED But he made Alias Have you seen the rape Carol joke or how Jess talks to other women in that book But his Avengers WANDA MAXIMOFF DESERVED BETTER But gay Bobby Outed by telepath,gender,True,False,-0.3542,True,False
Exactly they would simply call him “weak” or a “bitch” for not fighting back but once a man says that same shit to a female he’s cancelled,gender,True,False,-0.7811,True,False
if ur only personality on here is saying u hate gay ppl and making rape jokes pls get a job u got too much time on your hands,gender,True,False,-0.7964,True,False
"Just days after an ""anti-feminist lawyer"" murders the son of a female judge, a Florida congressman calls @AOC a ""disgusting,"" ""fucking bitch.""",gender,True,False,-0.9099,True,False
@alecksaur I saw that. She made a joke out of being gay and date rape in one sentence,gender,True,False,-0.4939,True,False
"@davidmarkwriter @suziedoore don't worry about her, she's a Joyless Feminazi (TM)",gender,True,False,-0.2718,True,False
WHERE NO GAY PANIC OR RAPE JOKE HAS GONE BEFORE!,gender,True,False,-0.509,True,False
"Nutshell, the joke is either about being gay, or that if you are on bottom during sex you are ""submissive"" or rape. According to most ""liberals"", all are offensive. There is the irony.",gender,True,False,-0.8402,True,False
"RT @garethjumaoas I'm not sexist, but female comedians just aren't funny",gender,True,False,-0.0795,True,False
@GovMikeHuckabee Dude your a JOKE! Can you just shut up. First Chik-Fil-A now spinning the Rape Comment. We get it you hate WOMEN + GAY,gender,True,False,-0.7756,True,False
@DanaSheehan What right do you lack?,gender,True,False,-0.3182,True,False
RT @youngthug: Horse face hoe stop playing before I show the world yo lil ugly ass,gender,True,False,-0.802,True,False
"like, just now, I'm watching a female streamer playing Sea of Thieves. and a dude just randomly calls her a bitch...like? She literally did nor said anything to deserve it. And she says she gets that SO much, she doesn't care anymore. But just WHY?",gender,True,False,-0.2901,True,False
"I honestly cannot belive people are hating on @RonnieRadke for what ge said, so what, he made a funny joke. Elijah literally accused ronnie of rape and murder thats so much worse than a gay joke, my brother is gay and he laughed at that. All these snowflakes need to just leave.",gender,True,False,-0.8008,True,False
ik u make jokes abt kpop idols being gay and all that but rape is another thing and that is very wrong,gender,True,False,-0.9125,True,False
@LUNAraps: shut yo bitch ass up! https://t.co/IemN1u0gm5 &#128557;&#128514;,gender,True,False,-0.8221,True,False
"The Miseducation of the American Boy Why boys crack up at rape jokes, think having a girlfriend is “gay,” and still can’t cry—and why we need to give them new and better models of masculinity @peggyorenstein https://www.theatlantic.com/magazine/archive/2020/01/the-miseducation-of-the-american-boy/603046/?utm_source=twitter&amp;utm_medium=social&amp;utm_campaign=share",gender,True,True,-0.2023,True,True
she shookcause he anti gay and rape joke tweets are surfacing,gender,True,False,-0.7003,True,False
"Also, nice rape joke/false rape accusation? Your co-worker is going to be disappointed however when she reports me to authorities, since I'm about as gay as a unicorn farting rainbows. So. . .",gender,True,False,-0.9136,True,False
"Rape jokes are awful, period. Whether it was said by a Presidential candidate or a gay comedian. Dapat hindi tayo bias.",gender,True,False,-0.6705,True,False
Gay Twitter and Rape jokes can miss me... Lemme stay in my lane &amp; Tweet about hoes.,gender,True,False,-0.6486,True,False
"I understand on some level, but still disagree. Gay jokes were meant to mock homosexuals- yet they still opened minds forced people to recognize that homosexuality was everywhere and even normal. Prison rape jokes are often meant to mock those affected, but expose the issue.",gender,True,False,-0.979,True,False
"Rape and murder of women, Pedophilia, Jew jokes and calling your buddy gay is not actually the height of funny.",gender,True,False,-0.7579,True,False
Do you think it’s appropriate for a male member of Congress to call a female member bitch?,gender,True,False,-0.5859,True,False
"Guys, piece of advice, rape jokes are NEVER funny. I don't know much about women as a gay man, but that I tell you with certainty.",gender,True,False,-0.1414,True,False
"Question - since when is calling a female colleague a ""Fucking Bitch"" equated as being treated as an equal? So if you were to call one of your female associates one as she walked away, the two of you would share a laugh? Your form of equal does not equal respect.",gender,True,False,-0.2975,True,False
"But if you call a man a bitch it’s an insult, and if you say a woman has balls it’s because she’s strong. We need to stop this gender bias female thing. Balls are about the most tender thing on the planet ever try tapping one? Ovaries can take a pounding, and bounce right back.",gender,True,False,-0.8625,True,False
"never said i don’t think im a female, i just said it makes me uncomfortable when men call women females. it feels very dehumanizing. and you’re wrong, i’m absolutely a bitch, people just don’t notice",gender,True,False,-0.9256,True,False
"Considering James made a joke about the rape allegations, this was probably his doing... but not funny and harry shouldn't of said it. Moore is far-right; he thinks being gay is perversion, that women should stay at home and is racist.",gender,True,False,-0.9301,True,False
i meant i’ve never heard of a female that lets a guy call them a bitch,gender,True,False,-0.5859,True,False
"We're not only attacking your comedian b/c of BTS, not only was he xenophobic, he made""jokes"" about rape of women, and no one finds that funny but morons, and we care about our idols go ahead and say BTS are gay and you don't like them but Alex also insulted are fandom",gender,True,False,-0.6932,True,False
it's 2015 why are there still gay slurs and rape jokes,gender,True,False,-0.5719,True,False
Im not giving up my female friends just to make my significant other feel comfortable. If i turn my back on someone i call friend then wtf u think imma do u to bitch ole goofy ass,gender,True,False,-0.409,True,False
"in all fairness, tho, The Hot Chick was better than it had any right to be. It's still not good and the gay panic rape jokes have aged EXTREMELY POORLY but it's not as unrelentingly cringy as you would expect a movie about Rod Schneider switching bodies w a teenage girl to be",gender,True,False,-0.5028,True,False
I don’t call other guys a fucking bitch unless I’m describing what they are doing with a female dog. Which I’ve never seen.,gender,True,False,-0.624,True,False
> trans women more this time. In 5 Haruka works with Yoko and it's nbd but then some gay men literally try to rape Shinada as a joke???,gender,True,False,-0.6848,True,False
"This bitch has no right to talk about fair and has no right to celebrate, I hope that they crash and burn they don't deserve to be here #mkr",gender,True,False,-0.25,True,False
"Deprived of new women to hate in Toronto, A Voice for Menners resort to rape jokes, gay bashing | man boobz http://manboobz.com/2013/10/02/deprived-of-new-women-to-hate-in-toronto-a-voice-for-menners-resort-to-rape-jokes-gay-bashing/",gender,True,False,-0.8885,True,False
 it aint nothing to cut a bitch off ,gender,True,False,-0.66,True,False
"for sure man, i can tell you there is much more to the world than ""jews bad lel"", ""them gay are pedos!!!"" and ""transes are the rape my wife and child!!"" there are way funnier jokes out there being made/waiting to be made",gender,True,False,-0.6562,True,False
"You write, ""There is no causal link between men refusing to “call out” a sexist joke and the rape and murder of a stranger."" Wrong. One established risk factor for men's perpetration of rape is male peer support, the belief that peers agree with their behaviour. Speaking up helps pic.twitter.com/ywtfBSMTrr",gender,True,False,-0.9451,True,False
"I mean for crying out loud there are people that still use gay as an insult and make racist, sexist, and rape jokes and ableist comments.",gender,True,False,-0.9337,True,False
"LOOK WHO'S TALKING THERE, SAYING ""GAY"" AND MAKING ""RAPE"" JOKES. SO IMMATURE",gender,True,False,-0.5719,True,False
"RT @CamTayylor: I'm not sexist, but generally speaking, girls just aren't funny? With the exception of about 3, none of them that I know, m…",gender,True,False,-0.4782,True,False
"RT @kahylahoran: There's nothing funny about gay, eating disorder, self harming and rape jokes",gender,True,False,-0.9082,True,False
Cele|bitchy | Miley Cyrus jokes about date rape: 'Everyone's gay. All it takes is one cocktail': Miley Cyrus d... http://addl.cu.cc/KFf,gender,True,False,-0.5719,True,False
"RT @AriaAkariCo: @YesYoureSexist @IWUWildcat85 nice meme you fag, it's part of mythology and making a female Thor is an retarded try to car…",gender,True,False,-0.6124,True,False
"It was a joke though. He literally just stated he has a fear of his son being gay. You're saying any joke is okay? So we should joke about kids with cancer, rape, suicide. There are certain topics that shouldn't be used in jokes",gender,True,False,-0.8375,True,False
RT @danieImao Ok I'm not sexist but no one gives a flying fuck about womens football,gender,True,False,-0.4249,True,False
Y’all don’t you ever call me ugly I got females stocking my life after finding out I use to talk to their man months ago. Before they became a thing do y’all hear that “JUST TALKING” man I’m that bitch that’s making them insecure .,gender,True,False,-0.872,True,False
"@TallyDude U R funny, I state facts like beheading, rape, killing gays, enslaving girls, treating woman like dogs, and you joke bout hotels",gender,True,False,-0.25,True,False
Sucked in Kat and Andre you should be embarrassed not just with your food but your behavior #karmaisabitch @mykitchenrules #mkr,gender,True,False,-0.4118,True,False
"if a conservative female rep is called a ""fucking bitch"" by another rep at the Capitol, she should call it out too. there's no reason to let misogyny continue",gender,True,False,-0.7425,True,False
"K*vin H*rt in 2011: *jokes about killing a gay son* Y'all: he's disgusting and needs to be punished. J*mes G*nn 200? - 2012: *jokes about 9/11, AIDS, the Holocaust, rape, transphobia, homophobia, pedophilia, masturbating on a child* Y'all: Plz come back to make space movie",gender,True,False,-0.9217,True,False
"Sorry, but your Mike-Pence-is-a-closet-gay-so-he'll-enjoy-getting-raped-in-prison jokes are so fucking not appreciated here. It's a joke about gay men enjoying rape. That's not cool.",gender,True,False,-0.6817,True,False
"@theesudani 1. No, cause fuck these niggas. 2. Does ""female"" offend you? Would you prefer we call you bitch? 3. Stop mkaing up shit to reach for",gender,True,False,-0.9514,True,False
So let me get this straight a reporter(female) can call @PressSec a bitch and it’s ok but a man cannot call AOC a bitch( which she is) because that’s sexist? This is so stupid.,gender,True,False,-0.9258,True,False
men who call females bitches disgust me shits just disrespectful- let somebody call ur momma a bitch and see how u feel then,gender,True,False,-0.9403,True,False
"Since SNL has an affinity for ""lol Trump and Putin are gay together"" jokes, I'm gonna go ahead and count on Ben Stiller reprising his role as Michael Cohen in a prison rape slapstick event for the ages.",gender,True,False,-0.6369,True,False
"The funny thing abt people (male & female) who have a tendency to call a woman ""a fucking bitch"" is that they'll do it behind the woman's back, then deny it when caught. If they ever grew a pair and said it to our faces, we fucking bitches might muster up some respect for them.",gender,True,False,-0.6894,True,False
"@Melh190 its 2016. ""Jokes"" about gays, aborigines, rape, violence against women etc. not funny. #ausvotes",gender,True,False,-0.8808,True,False
RT @Yooo_Fredd I'm not sexist or anything but I do not take female rappers seriously I would never buy a Nicky Minaj album or something.,gender,True,False,-0.2617,True,False
"RT @James_Kakisingi I'm not sexist. But I dont like dealing with women, when there is business to do. They are too emotional",gender,True,False,-0.1938,True,False
"rape isnt a bloody joke. whoever said this bullshit should get this straight in her messed up head. plus, he's gay. #weknowtherealharry",gender,True,False,-0.8737,True,False
"She's crying over how poorly she raised you. @MAFGHAN94 Where's my mother, I'm in need of a sandwich #notsexist",gender,True,False,-0.4767,True,False
"It’s crazy how dated “Wedding Crashers” feels, with it’s rape and gay jokes. Then again it’s been 10 years.",gender,True,False,-0.7269,True,False
"I say HAL's death in 2001 (a movie often criticized as emotionally cold). Can't get behind the Abyss scene. Goes on too long for me to believe she wouldn't have suffered brain damage. And then there's the obligatory Cameron ""slap the female character and call her a bitch"" part.",gender,True,False,-0.8799,True,False
It's twitter...acting gay is cool on here. “@makayla_tyler:do rape jokes make you cool?&#13;did I miss a memo or are you lot just fucking sick.”,gender,True,False,-0.4588,True,False
RT @TheRealFattLaff: @YesYoureSexist Thats not what I began with so...your dumb. But yeah I see what u mean the fact they all suck goes w/o…,gender,True,False,-0.4939,True,False
@Weeezza Gosh I dislike those two girls. They just aren't hot either. #MKR,gender,True,False,-0.3818,True,False
"I make fun of every topic, gays, blacks, rape but yes I feel bad for rape victims but my rape jokes are targeted at the females that falsely accuse guys of rape",gender,True,False,-0.9821,True,False
"Just so yknow rape cases happens to men too (bukan gay, tolong eh) There are cases just not taken as seriously because when they do tell the world, the world ridicule them &amp; funny cause the people who did all the ridicule are also men. Please dont make a joke out of this matter",gender,True,False,-0.7919,True,False
"Ok, so should I be laughing at the gay rape joke on #Archer?",gender,True,False,-0.0772,True,False
"And not one went anywhere! Didn't loud mouth Talib call the President a motherfucker? AOC isn't a bitch, female dogs are a hell of a lot smarter than her! Yoho shouldn't insult female dogs!",gender,True,False,-0.5109,True,False
Period. Worried bout the wrong shit. Them mfs call us bitches &amp; hoes too. You think we mad about “females”??,gender,True,False,-0.9465,True,False
@RepTedYoho so you think it’s ok to accost a female and call her a fucking bitch??? What a low life you are!! I hope you are expelled!!,gender,True,False,-0.7004,True,False
A female will have relations with 30 mfs but will call you a cheat if they catch you giving any bitch the time or day ion get it,gender,True,False,-0.7964,True,False
If i wanted to call a girl a bitch I’d jus call her a bitch ion need no cover words but like i said if it was between bitch or female I’d take female like if a girl called me a male shit better than callin me a nigga,gender,True,False,-0.7311,True,False
