tweet_text,cyberbullying_type,is_targeting_women,needs_review,sentiment_score,is_hostile_to_women,is_hostile_needs_review
"Rape is crime and it can't be a joke. Invading women bodies isn't a joke. On few issues oneself have to be clear and Rape is one of them. There is no excuse of raping anyone, men, women, girls, children, transgenders even lesbian or gay. #WomenIsHuman #SayNoToRape #reportrape",gender,True,False,-0.9643,True,False
are u slow i said when they let us as in FEMALES call them as in MALES bitch as in FEMALE DOGS,gender,True,False,-0.5859,True,False
"@holliebakerlutz Why was she fired, do you know?",gender,True,False,-0.5574,True,False
"@mannythemenace Call me sexist, but I hate female receptionists. They always give me attitude like I'm the reason their bf broke up with 'em",gender,True,False,-0.7579,True,False
@KissMySmilee: Don't got time for bitches to be actin iffy.,gender,True,False,-0.5994,True,False
@MarkHosking1 @MickFloyd I was really hoping Crazy Bambi scored the Butcher Sluts a strategic 10 #mkr,gender,True,False,-0.5082,True,False
"#thisistheend - almost 2 hours of Rogen and co. shouting 'Oooh shit!', gay panic and rape jokes. McBride and Cera funny, otherwise tiresome",gender,True,False,-0.8398,True,False
RT @cornfedbeachbum Women comedians suck #notsexist #disappointed,gender,True,False,-0.5859,True,False
Quaazzzyyy some females won’t fuck wimme cause of who i call my bruddas I switch for no bitch #4L on my way too more bread,gender,True,False,-0.1098,True,False
"@MTVNews @FrankieJGrande There are NO Best Frankie moments on BB! He lied about being superfan, made rape joke &amp; misrepresented Gays #bb16",gender,True,False,-0.8883,True,False
"To those who threw shade and hate against @mannypacquiao when he opposed gay marriage, where are you now on #Duterte2016's rape joke?",gender,True,False,-0.802,True,False
"Simple fix, just don’t use females. It comes off as diragatory, aggressive, and overly misogynistic. Also, it ruins your argument. You can’t bitch about ***WOMEN*** and then call them females in the same sentence...it’s an automatic “IM A MISOGYNIST” response to anything.",gender,True,False,-0.8689,True,False
"70,000 men a year get raped in prison. Its no fucking joke. You werent there. The gay man he beat, also was accused of trying to rape his previous cellmate.",gender,True,False,-0.9594,True,False
"RT @Tcrawford714 Call me sexist, but I don't like watching football with a female commentator",gender,True,False,-0.395,True,False
@Deb_Hitchens who did that? You just say shit. Women have 100% equal rights. You are too dumb to realize that. #feminazi,gender,True,False,-0.7845,True,False
"as another fellow gay please don’t compare reversing on the highway jokes to rape, racist and homophobic jokes",gender,True,False,-0.6597,True,False
But u think it’s over a guy and it really isn’t I have no problems with him and females at all we’re nothing but if a bitch calls me names and belittles me what happens after is HER FAULT right!,gender,True,False,-0.8502,True,False
"all guys joke about are rape, being gay, and women not being funny.",gender,True,False,-0.7101,True,False
 jus meet son now he ya mane ass bitches  #Shots,gender,True,False,-0.8126,True,False
"Only rape jokes are sick and disgusting. Gay, race, and sex male or female jokes, will always be funny to normal people. Fuc the weirdos, puritans are pathetic, male feminists are creepers, cancel culture is problematic, and PC advocates need a therapist, and a life.",gender,True,False,-0.9451,True,False
"There was a rape joke, making fun of gay people, and someone using Caitlyn Jenner's pre-transition name. Fuck sakes, come on people",gender,True,False,-0.5719,True,False
lowkey wanna hv a female dog so i can call her bitch,gender,True,False,-0.5859,True,False
"@duckyties she followed me but i blocked her,, rape jokes and homophobia are not things i want anywhere near lol like hello im a gay woman",gender,True,False,-0.2693,True,False
"YES REALLY AND NO ONE CARES ABOUT YOU! ahahahahah @papi4481 I'm not sexist, but a new Ghostbusters movie with a female cast....really?",gender,True,False,-0.3891,True,False
"@Allehegens Walker is clearly the one Dems fear.  I don't know much about him, either.",gender,True,False,-0.128,True,False
RT @wk1jase I'm not sexist but they really making it hard to act otherwise. #franga,gender,True,False,-0.249,True,False
"RT @joshpowers32 Look, I'm not sexist, but tell me you don't get at least a little nervous when you see a woman truck driver",gender,True,False,-0.2983,True,False
"My child is dating her Grandfather, and I'm gay. Also my other child got cancelled for making a rape joke.",gender,True,False,-0.6705,True,False
">made out with OFW >rape jokes on a murdered female missionary &gt;rape jokes in general &gt;denies hating gays, but also throws it out as an insult &gt;calls leni weak just because she's a woman well tama naman po kayo, matotoo naman siya. totoong gago. :)))) -P.S. not dilawan :)))",gender,True,False,-0.9535,True,False
"RT @oldgfatherclock: @YesYoureSexist @All_HailCaesar not really sexist though is it, taking the piss out of feminists, not women.",gender,True,False,-0.4019,True,False
RT @JessieVercetti: Issa bad bitchð¥ https://t.co/Xe1oJ5xGd4,gender,True,False,-0.5423,True,False
I hate when people call me mean especially females. Bitch I ain’t mean I just don’t like to kick it and I speak when I’m spoken to,gender,True,False,-0.7414,True,False
@HBMostDope: Ugly bitches be like I'm my own WCW duh bitch you ain't nobody elses&#128514;&#128514;,gender,True,False,-0.8591,True,False
"RT @joe_kriz Not sexist, but it's hard watching a game when there is a female commentator.",gender,True,False,-0.1531,True,False
Under NO CIRCUMSTANCE is it okay to call a female a bitch. And that’s that.,gender,True,False,-0.7034,True,False
"You put up with a lot of crap as a Congressional staffer, but I can't stop thinking about being a female staffer for a member who thinks it's okay to call another member (or anyone) a ""fucking bitch""",gender,True,False,-0.58,True,False
Why can y’all call us niggas but wanna get all political correct when we generalize y’all and say “bitches” I hate them kinda females like girl u act like I know u it’s the lingo get over it,gender,True,False,-0.1698,True,False
RT @uberfeminist: Emotional Terrorism https://t.co/OnrVC8tOXv #TwitterFeminism,gender,True,False,-0.6124,True,False
I call bitches females. Stfu. This some bullshit.,gender,True,False,-0.8271,True,False
"There are thousands of good words out there -- jerk, creep, cretin -- but his actions have nothing to do with whether he's gay or not. It's like prison rape jokes. I can laugh about almost anything -- but not that. And not this. (Usually, when I bring this up, I get blocked.)",gender,True,False,-0.1685,True,False
RT @ArchAngel_Dux im not sexist but women just cant be comedians nor can they be rappers...,gender,True,False,-0.3252,True,False
"If women take part in gay jokes but say men are trash when rape and femicide jokes are made, they're hypocrites and we will be here to call them out",gender,True,False,-0.6757,True,False
"@RandomHero30 @rooshv @minasmith64 I get that.  A Rotherham Redux.  But, who raped Cytheria?",gender,True,False,-0.8126,True,False
"@SportsNation so far Aries has made a White Women joke, Rape joke, Gay joke, and reference to killing a special needs child... #NotFunny",gender,True,False,-0.4215,True,False
"I know I'm supposed to care about the double standard with this cardi b ""drugging and robbing"" dudes story. But I all I hear in my head is that Chappelle line during a gay rape joke where he said ""welp.. caught me slipping.... You gotta walk that shit off!""",gender,True,False,-0.8702,True,False
"Niggas be like “females this, females that” like.. just call me a bitch so we can fight",gender,True,False,-0.6204,True,False
"@Iipkloss I don't have a sister either, but you're just another disgusting feminazi bitch, so we cool",gender,True,False,-0.8143,True,False
"Our January/February cover story by @peggyorenstein is out now: Why boys crack up at rape jokes, think having a girlfriend is “gay,” and still can’t cry—and why we need to give them new and better models of masculinity. http://on.theatln.tc/iKiiV6a",gender,True,True,-0.2023,True,True
"A female friend always calls my dance style unique, the truth is, bitch, i'm just wasted and trying to not fall over.",gender,True,False,-0.3612,True,False
Boooring @antrooney10 Am not sexist but women can't play football!,gender,True,False,-0.4303,True,False
RT @JakeDandrea_: @YesYoureSexist @AnthonySammarco Stop being a feminazi because you struggle at attracting the other sex. Stop starting dr…,gender,True,False,-0.3818,True,False
I have never heard a man ever call another male coworker a f@cking anything in my professional office.. I also have disagreed with other female workers and didn’t call them a fucking bitch (I might have thought it though),gender,True,False,-0.7501,True,False
RT @BeRh00M if we are talking about a viking sized man with huge amount of lust and a 150cm girl .. then no I wouldn't like it,gender,True,False,-0.2523,True,False
.@scarmichael18 @shaner38 She will often not know.  It should be opt in not opt out so that he must be told.  Or else they will hide it.,gender,True,False,-0.1779,True,False
"Maybe she'll have cleats on. @tbowditch12 Call me racist, call me sexist, but every time Olivia Chow talks in this debate, I wanna slap her.",gender,True,False,-0.1531,True,False
@feministlah @GreenWeiner No.  Valid point.  I have never actually seen an MRA say he hates women (openly) like #KillAllMen etc.,gender,True,False,-0.1027,True,False
"RT @jeffhumps: A woman doing college play-by-play just sounds wrong. I'm not sexist, but seriously get back in the kitchen.",gender,True,False,-0.0703,True,False
i told that lik bitch she was ugly .. i hope sge aint get offended ð¬,gender,True,False,-0.5362,True,False
"the gay pedophile woman joke, charlie brown getting turned on by ""peppermint patty and that other l*sbo"", most of the rape jokes tbh",gender,True,False,-0.4144,True,False
"I substitute bitch for that word when I'm mad at a female. No reason to be completely disrespectful. But if I do ever call a woman a bitch, just know she earned that shit",gender,True,False,-0.9451,True,False
"yet he didn’t rape a woman with a fork he threatened too as a joke as bad as it is it’s not as bad as actually raping her with it, also the gay man tried to molest x, you are all about defending yourself if someone sexually abuses you but if it’s someone you don’t like it’s wrong",gender,True,False,-0.8939,True,False
"same like i said , joke around with people you know , be gay and say you gon rape them , idc , but don’t go around setting a bad reputation for others cause it really a bitch ass move",gender,True,False,-0.9585,True,False
"RT @GoJonnyBananas I hate tweeting this but, the blonde girl on the British curling team has extraordinary eyes #notsexist #justsaying",gender,True,False,-0.3291,True,False
"RT @_tshegoxo: “@ReIgN_CoCo: It Takes A Peanut Size Brain To Find Humor In calling Somebody Ugly, Gay,Hoe And On Rape Jokes!Honestly!!!”",gender,True,False,-0.8429,True,False
@boxedariel @LostSailorNY No one said she should.,gender,True,False,-0.296,True,False
RT @trish2295: Fucking rigged - r u kidding they didn't even make a mediocre meal - there was no sass - they just being kept for ratings - …,gender,True,False,-0.5563,True,False
If a Man RAPE Another Man: GAY.. . . . . . . . If a Man RAPE 11 Men: #GAYLE #joke,gender,True,False,-0.8926,True,False
"RT @ben_sulley I don't care if people call me sexist, I don't find female comedians funny",gender,True,False,-0.1571,True,False
"Your understanding of good and evil is a little warped my friend - head chopping, child rape, dressing women in black sheets, gay killing and slave trading are in fact evil, all are prevalent in countries you love, like Syria, Libya etc. You are a joke and detached from truth.",gender,True,False,-0.6557,True,False
RT @DaveParky14 Not sexist but an all female cast for a re hash of ghostbusters sounds....well shit really,gender,True,False,-0.7096,True,False
@DjentTheRogue There's a lot of stuff that gets taken out of context. Rape jokes. Gay/Fag jokes. Get in the kitchen jokes.,gender,True,False,-0.1779,True,False
"Twinkle, twinkle little bitch, close your legs it smells like fish.",gender,True,False,-0.2516,True,False
RT @kushkingmorris: I can't even sit down and watch a period of women's hockey let alone a 3 hour class on it...#notsexist just not excitin…,gender,True,False,-0.25,True,False
"@mxattx @antiquusxy ""I hate it when women control the conversation on their own problems, but that doesn't make me sexist.""",gender,True,False,-0.4939,True,False
Don't call bitches females. That's mad disrespectful. Bitches hate when you call them females.,gender,True,False,-0.825,True,False
@ItsYahBoiRay: @anelylove if I don't get my dick sucked at yo party by a bad bitch I'm fr gone set it off &#128514;&#128514;&#128514;&#128514; *by @anelylove *,gender,True,False,-0.7094,True,False
#MileyCyrus adds to her oppressive bag of tricks by making a #rape joke about date raping people to 'make them gay'. http://www.bustle.com/articles/24073-miley-cyruss-date-rape-joke-crossed-the-line-wasnt-cute-or-funny,gender,True,False,-0.91,True,False
I don’t find it attractive when dudes call females bitches and hoes,gender,True,False,-0.25,True,False
RT @AlejandroDaGr8: RT @drumbeats4peace: Woman in Atlanta who was killed by police yesterday is #AlexiaChristian. She was indeed handcuffed…,gender,True,False,-0.6705,True,False
It's always the filthy bitch that comes in the picture.. Ã°ÂÂ¤Â¦Ã°ÂÂÂ½Ã¢ÂÂÃ¢ÂÂÃ¯Â¸Â,gender,True,False,-0.5859,True,False
@RepTedYoho Why did you call a female colleague a bitch? You should resign immediately and we will work very hard to make that happen.,gender,True,False,-0.7841,True,False
@m0ses__ gay! You leave me here! And no joke I will find you and rape and then kill you!,gender,True,False,-0.9241,True,False
"the next thing I wish the world argues about is everyone who calls a female a bitch ong , shi is just as bad as the other word we givin people shi for sayin",gender,True,False,-0.802,True,False
@luckykaa It is our individual listing numbers on a Gamergate block list the SJW feminists created.  Worn with pride...,gender,True,False,-0.1779,True,False
Can you call a Male- a bitch? Or is only for females?,gender,True,False,-0.6322,True,False
@Antifeminazi1 @FeministFailure @Feminazi_Front why is it that radi fems call for an end to domestic abuse on women? Y not on men too?,gender,True,False,-0.6767,True,False
"half the **white chicks** that yell at me for not being PC with my jokes watch The Office, where there are jokes about gays, blackface, and date rape...",gender,True,False,-0.4019,True,False
Also covert rape jokes like “everyone in here is gay” just isn’t ok.,gender,True,False,-0.296,True,False
"@sonjdol there's nothing liberated about making gay sex/date rape jokes. Men are (rightly) routinely criticized for making similar ""jokes.""",gender,True,False,-0.6369,True,False
"RT @Jack_smiff1 Call me sexist, but I hate most women on sports center. Everything is just seems so scripted by them.",gender,True,False,-0.7227,True,False
Dudes who call females bitches every other tweet are so unattractive smh...I don’t see what y’all see in those kind,gender,True,False,-0.6418,True,False
"Watching ""The Eiger Sanction"" and can't get past the way an otherwise interesting take on the espionage story is ruined by heavy-handed early '70s efforts at ""edgy:"" the rape ""joke,"" the interracial romance, the gratuitous sexism, the Native American squaw, the mincing gay guy.",gender,True,False,-0.0772,True,False
I’d never call a woman a female I got to much respect for bitches,gender,True,False,-0.2023,True,False
The hypocrisy... SO you KNOW there’s no casting couch but VIC IS GUILTY WITHOUT A DOUBT!!! It’s satirical when you guys make gay rape jokes but VIC IS HOMOPHOBIC FOR SUR!!!! Monica is a saint and you should always believe victims BUT THE VICTIMS OF CHRIS ARE LIARS!!!,gender,True,False,-0.9746,True,False
"If you ever want to call your parents a bitch but you don't know how to in English? Allow me to teach you the other alternative. chienne Which translated is female dog. Which means bitch! Ever wanted to say ""dirty casual"" in another language. Allow me to show you-",gender,True,False,-0.7712,True,False
"nevr trust a bitch who calls women ""females""",gender,True,False,-0.128,True,False
no matter how much I hate men i have never purposely degraded them by calling them “males” or “niggas” so why do they call us “females” and “bitches”,gender,True,False,-0.3489,True,False
"I’m pretty sure I am, bc everyone who’s seen this most likely would pass on that. Lmaoooo and you right I am that BITCH. That word don’t bug me lol but only bitch made men call females a “bitch” so I mean I guess you speak for yourself",gender,True,False,-0.6504,True,False
"@theJPDH ""the majority of shoppers are women, there are some bad cart drivers out there, hashtag not sexist"" Nice try.",gender,True,False,-0.7033,True,False
Her Dad must be proud. RT @Gawker: Miley Cyrus rode a blow-up dick and told a date rape joke at a London gay club. http://gaw.kr/eZuBoXm,gender,True,False,-0.5719,True,False
"TWINKLE TWINKLE LITTLE WHORE you're at school, not Jersey Shore. you're a slutty, orange mess PLEASE GO FIND A LONGER DRESS.",gender,True,False,-0.8496,True,False
"RT @Shermertron: @MT8_9 Has she been fired yet? Male writers for ""newspapers"" usually get fired for much less. #QuestionsForMen",gender,True,False,-0.802,True,False
"I don't care if the joke is about raping a man, woman, transgender. I don't care if you're ""not even gay!"" It is not okay to normalise rape.",gender,True,False,-0.9384,True,False
It's sickening. I thought her comparing someone using mean words towards her to being a RAPE victim was as low as it gets and then come the gay slurs and jokes about people dying of AIDS? Whatever programmed this thing is a damn monster.,gender,True,False,-0.9291,True,False
"#MKR maybe you girls should go back to cutting up cows and pigs, don't quit your day job!! @mykitchenrules",gender,True,False,-0.2695,True,False
Well if it's her responsibility to keep herself safe then thats exactly what she did when she took the picture of thr license plate. But you called her a bitch for that. Then again any guy who calls women females is automatically trash anyway so I'm not surprised you don't get it,gender,True,False,-0.7265,True,False
She never call herself a bad bitch. She aint worried bout trends. She dont care about competition with other females. She hates gossip. She ain't up in everybody face. She loves her natural beauty. Reality tv stars aint her role models. She weird. A complete sqaure. I want her.,gender,True,False,-0.466,True,False
"makes rape jokes, poking fun at women who wear makeup, toxic masculinity, insecure when you are making more money, hates anything ""feminine"" because he doesn't want to be called gay... I could go on really..",gender,True,False,-0.765,True,False
"She got hired by Maverick Carter and LeBron's company for a PR/social media position after using gay and racial slurs and making rape jokes as recently as last week, I believe.",gender,True,False,-0.5719,True,False
"RT @Mr_LayedBak: I'm not sexist... but women refs are a no no""",gender,True,False,-0.4215,True,False
All of our daughters will be called bitches by other woman way more often than by men. We all know it’s true. More females will call each other bitches during the high school years than men will do to them their whole lives. This is bullshit..,gender,True,False,-0.8689,True,False
"RT @HipsterNudesGod: I'm not sexist but I truly believe that 9/10 women cannot drive idefk why the hell they can't, but they're deadly behi…",gender,True,False,-0.5499,True,False
HAHAHA couldn’t be bothered with a caption but am just like.... why the rape joke kids meeting up with the man who thinks the government puts chemicals in the water to make frogs gay this can only get worse,gender,True,False,-0.6842,True,False
"The Miseducation of the American Boy. Why boys crack up at rape jokes, think having a girlfriend is “gay,” and still can’t cry—and why we need to give them new and better models of masculinity https://www.theatlantic.com/magazine/archive/2020/01/the-miseducation-of-the-american-boy/603046/?utm_source=twitter&amp;utm_medium=social&amp;utm_campaign=share",gender,True,True,-0.2023,True,True
RT @MeninistTweet: Girls are ruthless smh http://t.co/s7g5R2fOU6,gender,True,False,-0.3182,True,False
"Rape Jokes are never funny no matter what gender does it. A woman ""flipping roles"" to make GAY RAPE JOKES proves she's an IGNORANT JACKASS",gender,True,False,-0.9443,True,False
"stop with the race jokes, the rape jokes, gay jokes, stop attacking writers, stop bashing women while worshiping men, stop being possesive",gender,True,False,-0.8591,True,False
"Me: Almost lost my military career for being gay, sent to conversion theraphy for being accused of rape &amp; they tried to change me to stiraght, outed by friends for having HIV, religous family still hates me Stiraght man: heterophobia is real cause a random person made a joke",gender,True,False,-0.7584,True,False
"@rich_feminazi @kianasierraa irrelevant girl, give it 5 years. She's going to lose sexual market value. Then I'll ask her to pass the bag.",gender,True,False,-0.0772,True,False
"RT @__DEEsire__: ""you mad bitch ?""ð¤ ""stay mad !"" ðð https://t.co/J6TRKy4aAK",gender,True,False,-0.8883,True,False
RT @nowlinn Not sexist but I hate female sports announcers,gender,True,False,-0.7227,True,False
RT @NoahRough I swear I'm not sexist but about 90% of girls are terrible at video games. Maybe it's just my sister though.,gender,True,False,-0.6428,True,False
"Homophobes would only consider it rape if a gay man did that but when a woman rapes a man they consider it as ""lucky"" or ""he must've enjoyed it"". Some men actually joke about wanting to be raped by women &amp; it disgusts me so much i wish they never existed",gender,True,False,-0.7753,True,False
@AMohedin What is it that women lack that requires two women witnesses to replace one man?,gender,True,False,-0.3182,True,False
RT @BalockayAyAyRon: Call me sexist but I think a woman on a motorcycle is kind of dumb. Especially when she has ape hangers...,gender,True,False,-0.7086,True,False
"Prison rape isn't funny. ""Lol they actually consent"" isn't funny, either. These four men are all jokes in their own right, we don't need to stoop to gay jokes and making light of rape to get at them. Be better than the right.",gender,True,False,-0.9193,True,False
"RT @GrindMode407: I Cook Bitch ;p""@YesYoureSexist:BACK AT YOU DOUCHE @GrindMode407 Mannnn I'm not sexist but if you a female &amp; you can't co…",gender,True,False,-0.5448,True,False
.@Brittany_Blade Barb Sheehan NEVER says a word about being abused for 20 years.  Kills husband. Claims abuse w no proof. Walks. Fems cheer.,gender,True,False,-0.872,True,False
"specifically to direct prison rape jokes at. In 'Career of Evil', she writes a character who also appears to make fun of dysphoria, citing removing one's legs. In the Harry Potter series, all queer-coded characters are either villains or subject to the 'bury your gays' trope,",gender,True,False,-0.926,True,False
RT @failla21 Call me sexist but I don't think a girl should work at a gym. They are no help when you're alone and you need a spotter.,gender,True,False,-0.6583,True,False
I FUCKIN ð¤ BAD GIRLS CAUSE THEY HAVE BALLS https://t.co/qeANi6tj0I,gender,True,False,-0.7358,True,False
"RT @sggainey97: #LT of course I'm not sexist, but the way they spread their thoughts are annoying, and women have been equal socially for q…",gender,True,False,-0.5499,True,False
"@doubledumbass twerking, Penny Arcade rape joke backlash, Jack Nicholson retired, Batwoman can't get gay married, Syria.",gender,True,False,-0.5423,True,False
A female who thinks it’s cute when he calls her “bitch” and pushes her ass around,gender,True,False,-0.128,True,False
"forced sexual contact is a big no no , but women openly joke about how they have raped men and nobody bats an eye especially not the fellas cause they don’t want to be called Gay which is weird because rape is rape don’t matter",gender,True,False,-0.9709,True,False
"Yeah, child labor IS illegal. Unless you mean ""women""? @plaster_cole Girls should not be allowed to be commentators for football games",gender,True,False,-0.34,True,False
*texts me with a meme* *thinks I’m someone else* *awkwardly says hi knowing damn well who you texted* *calls me an attitude having bitch and block me* Females a different bread lmao.,gender,True,False,-0.6908,True,False
"Ok, well the next time a man calls U or a female friend/family member a fucking bitch, please don’t post about it. I don’t agree w/ some of AOC’s politics, but, in that speech she spoke for millions of women dead &amp; alive. Sad for U that her liberalism prevents U from seeing that.",gender,True,False,-0.7722,True,False
Curious here would it be unjust to cancel someone if the repeatedly used a derogatory word for gay person? Or if another person made jokes about rape and pedophilia and added music and sound effects to it? Personally I would consider it just.,gender,True,False,-0.7941,True,False
RT @AsheSchow: Yet another student settles with university over an unfair process resulting from campus sexual assault hearings: http://t.c…,gender,True,False,-0.7845,True,False
