tweet_text,cyberbullying_type,is_targeting_women,needs_review,sentiment_score,is_hostile_to_women,is_hostile_needs_review
I’ve read all there BS allegations.I watch the joke Jean Carroll on CNN w/ AC so bazaar they had 2stop the interview when she started saying rape was a fantasy &amp;flirting w/AC a Gay man! But than again we know that U don’t believe allegations on Lt just the RT,gender,True,False,-0.3699,True,False
RT @Pro_Equality_: @anotherfallow my uncle was shot 5 times and died because he kept denying his female stalker.  Stop acting like males li…,gender,True,False,-0.6908,True,False
@thatcountenance @Lweiting she bully me :(,gender,True,False,-0.7269,True,False
You don’t call a female a bitch but y’all not disrespectful..... right,gender,True,False,-0.34,True,False
"I hate Fox News because they will change what Yahoo said to sound like a Trumpy quote. Fox News: Yoho did not call @AOC a “fucking bitch,” he said “that darn female dog”",gender,True,False,-0.296,True,False
"I mean, we could call the entitled bitches, but then we’d be hurting my female dogs feelings. She’s a good dog.",gender,True,False,-0.1531,True,False
RT @JustCallHerKii: WTF !!! #LHHATL  just got juicy OMG she fuckin with her boss husband ð¶ð¶ð¶,gender,True,False,-0.7513,True,False
"there's always those people that say don't joke about shit like rape,being gay, suicide, fat people ect but people do it's lighthearted shit",gender,True,False,-0.3983,True,False
"@trishesdishes Are you aware women have more, not fewer legal rights than men?",gender,True,False,-0.1615,True,False
Eww he look gay RT @TreLeKidd: Bitches hate rape jokes but do shit like this https://twitter.com/TreLeKidd/status/473620513181696000/photo/1,gender,True,False,-0.8316,True,False
"@AMohedin Okay, we have women being physically inferior and the either emotionally or mentally inferior in some way.",gender,True,False,-0.5423,True,False
Go sit down somewhere you not ab to call a female a bitch like that dude it was never that serious she ain’t call you out yo name,gender,True,False,-0.2681,True,False
"Right thing by who's standards? There's comedians telling gay jokes, rape jokes, domestestic violence ones, etc. Yet this is where the line is drawn? Its pretty pretentious to think you know what offends who and try to ""rectify"" any sort of wrong doing. A joke is a joke is a joke",gender,True,False,-0.5504,True,False
#TxSU17 theres a gay RA that likes to rape boys in their tight little assholes. his name is robert. watch out for him. this is not a joke,gender,True,False,-0.8071,True,False
"@SparklyBuns that she acts like a retard sometimes/uses retard/retarded several times, makes jokes about gay people, jokes about rape,",gender,True,False,-0.5574,True,False
I do refer to female animals as bitches because a) taxonomy and b) it’s way funnier to call a kitten a bitch than it is to call a woman one,gender,True,False,-0.7184,True,False
RT @austin_philippi: Actually I hate people who talk about any sport when they can't name over 50 players playing that sport.. #mostlywomen…,gender,True,False,-0.4404,True,False
@SumbelinaZ @TIB2016 @IronmanL1 @Hatewatch You have to be extra stupid to be a woman and follow #Islam. http://t.co/F7ZtyNBDrQ,gender,True,False,-0.5267,True,False
"So when I hear ""retard"", ""gay"", ""rape them"", sexist jokes or slutshaming it lessens my ability to have fun with other players.",gender,True,False,-0.3612,True,False
I have to quit being tactful @SenatorBraun @SenToddYoung @SusanBrooksIN are fucking cowards who remain silent when one of their @GOP #WelfareQueen colleagues @RepTedYoho calls a female a fucking bitch Also they all want @realDonaldTrump to grab their pussies,gender,True,False,-0.5849,True,False
"Joke: Two divas after rape; -you should shout fight for your dreams and for gay rights - ""I'm no royal bitch, fuck you"". Rtweet if u smiled.",gender,True,False,-0.367,True,False
"I don't stats for straight male fear of gay rape. But prison rape jokes suggest a certain ubiquity. As for the other part, rates of sexual assault against women are appallingly high and frequently dismissed by the dominant culture. So its correlation. But a strong one, I think.",gender,True,False,-0.9577,True,False
RT @pdemmett: Why do film bosses have to make life weird #Ghostbusters with an all women cast... Why...Not sexist but it's just odd. Would …,gender,True,False,-0.5106,True,False
"@Iipkloss being a fuckface to a girl who just agreed, she doesn't want a feminazi hoe in her business, so fuck off.",gender,True,False,-0.8322,True,False
LIKEWISE @Reni__Rinse who's f****N dumb idea was it to change Thor to a girl? i hope you burn in hell! #NotSexist,gender,True,False,-0.7424,True,False
@comattwow @ChubsSays ...there is no beef here.,gender,True,False,-0.296,True,False
"To all the people who complain about how we can't have a female president because then what would you call her husband: I hear you, which is why the first female president is gonna be gay",gender,True,False,-0.3612,True,False
SHUT THE FUCK UP DUMB FEMINAZI BITCH!! THIS IS WHY I NEED MENINISM!!,gender,True,False,-0.9147,True,False
"we used to call them bitches, female was a big step sir calm down",gender,True,False,-0.3818,True,False
@clairetella men have boners to have sex but what about gay people? A gay guy could rape another guy?So it's not just sexist it's homophobic,gender,True,False,-0.8364,True,False
"man istg you cant call women shit , cant call em strong, cant call em miss, cant call em ma'am, cant call em bitch &amp; cant call em a female so how the hell do you address a woman if you dont know her name",gender,True,False,-0.2791,True,False
I guess we all hate Kat and Andrea but they all hated the frauleins more.You bitches cant win nor beat kat the dog #mkr #sorrybraunhilders,gender,True,False,-0.9618,True,False
RT @pwreclive: @YesYoureSexist im not saying women cant be great leaders or they are weak its the fact that they are incredibly more decept…,gender,True,False,-0.7347,True,False
"And most times the male making the rape jokes/sexually assaulting the leading (hetero) male are shown as either black or stereotypically gay, which pushes the thought that black men are aggressive and gay men are predatory.",gender,True,False,-0.8625,True,False
so proud of my daughter who called out and shut down the ass that was making rape and gay jokes in her English class today,gender,True,False,-0.5868,True,False
@AdoreZoey: How u gone bring ur side bitch to a game where You know Ya gf friends at ?! &#128553;&#128553;&#128553;&#128553; I SWEAR!!!!!,gender,True,False,-0.586,True,False
X: “Fuck nigga yuh fuck women yuhkill babies yuh punch women yuh kill gays yuh rape little girls yuh Ayy yuh” Someone: [ Makes X joke ] Edge Lords: “Omg plz be more sensitive”,gender,True,False,-0.9081,True,False
"@Grimezsz Pronouns do suck though. They is plural, she means make and he means female. We don't have to call a man a woman or a woman a man. It's SCIENCE BITCH",gender,True,False,-0.8143,True,False
"Nope, not one whit. @HarryMAllen I'm not sexist at all but women's sport is awful",gender,True,False,-0.6124,True,False
RT @katsferdayz And no I'm not sexist but a bitch is a bitch,gender,True,False,-0.9186,True,False
To assume that an adult woman would want anything from a gay man. You guys are so self absorbed. It's men all the way through who are the reason women have to suffer through rape and abuse and you claim they are sexist and predatory for enjoying fiction online. Disgusting.,gender,True,False,-0.9201,True,False
being gay does not give you the god damn right to make rape jokes towards a girl,gender,True,False,-0.6486,True,False
"People give words power. Go watch a woman with her friends call each other ""Bitch"" as a term of endearment. Now, you go ahead and try and call one of your female friends, girlfriend, or wife a ""Bitch"" and see what happens",gender,True,True,-0.34,True,True
You know you've made it as a strong female leader when your male peers call you a bitch. Dominant females in positions of authority are threats to old cranky white men,gender,True,False,-0.4588,True,False
I reported an incredibly sexist/homophobic account &amp; reported multiple tweets &amp; Twitter told me they weren't in violation even tho they literally said women need to rape more so there would be less gays. But yeah. What you said was just...wow...def see how that got you banned.,gender,True,False,-0.562,True,False
But wait why tf u would even think I give a damn about ur opinion! KMS hoe I have a fucking life!!!,gender,True,False,-0.6925,True,False
can’t stand y’all mfs who call Women/ Girls “Females” like bitch u tryna sound “respectful?” but u sound stupid as fuck LMAOO,gender,True,False,-0.9001,True,False
What a boring question. @Replacement2 Am not sexist but can women league football ever get the kind of attention the men's league gets??????,gender,True,False,-0.3839,True,False
"Not fond of the “prison bitches” line. I am disappointed at how many people, including liberals, treat prison rape like a joke. There is nothing amusing about inmates, including many gay and transgender people, suffering rape in prison. Rape isn’t funny.",gender,True,False,-0.9726,True,False
"Niggaz call females bitches all the time, only a few homeboys I let call me that, very few, ppl I date nah but if that’s what ppl allow u to call them then so be it",gender,True,False,-0.0772,True,False
Hashtag killerblondes is the dickiest hashtag in all  #MKR history... Seriously... Why not #butcherthemodels,gender,True,False,-0.1779,True,False
You're a dumb asshole. @jamiecowan92 I'm no sexist btw cause I'd punch a woman to show that she's equal #equality,gender,True,False,-0.6705,True,False
RT @fkn_always_ I'm not sexist but I don't like movies with women with the main role.,gender,True,False,-0.395,True,False
men who call girls females are the weakest link,gender,True,False,-0.5106,True,False
"@SultraSoV Yes and no.  1A issue but banned as ""sexist"" when a feminist shirt would not be...",gender,True,False,-0.4854,True,False
"Aah casual use of the sexist term ""terf"". It's associated with violence, threats and job loss against women want to protect the rights of children to grow up gay, women's rape crisis centres to exclude male bodied people and women's prisons to exclude male sexual predators.",gender,True,False,-0.9524,True,False
"RT @TheSpanishAfro_: The people at work are childish. Lol its run by women. Im not sexist but when women dont agree to something, oh man...…",gender,True,False,-0.3324,True,False
@ErikssonMalin85: #QuestionsForMen ever walked home in dark seen another person and becomed scared?  Men are attacked 4 times more often.,gender,True,False,-0.7096,True,False
RT @Barnflake: @EmmaaFlanagan @LisaNHayes Sexist is when people don't go because it's women. People aren't going because it's of a poor qua…,gender,True,False,-0.4767,True,False
you bitches will really call a female ugly just cause y’all don’t like her ...hater shit,gender,True,False,-0.9022,True,False
@fatslags_ad I know...that's the goal.  I'm here to expose their lack of sense.,gender,True,False,-0.4404,True,False
 bitches get cut off everyday B ,gender,True,False,-0.7184,True,False
"Watching edgy atheist on YouTube complain about how things like women can't be comedians has never read a super raunchy gay fantasy by a woman. Rape ain't a joke, but it opens a number of holes to be filled in with love. Unless of course its a slasher fic then it kills that joke.",gender,True,False,-0.1308,True,False
a man on 8 out of 10 cats jus made a gay rape joke and people laughed i wonder the reaction if it was about a woman,gender,True,False,-0.128,True,False
RT #News Miley Cyrus jokes about date rape: ‘Everyone’s gay. All it takes is one cocktail’:... http://bit.ly/1mRBwmu #Celeb #Bitchy #FF,gender,True,False,-0.7906,True,False
"RT @Kipjaime8: I may stop watching the NBA if Ophra has any ownership of a professional basketball team. Not sexist, but plenty of other qu…",gender,True,False,-0.1531,True,False
RT @OlieCoco: Fingers crossed Kat &amp; Andre go into sudden death - where they belong! #mkr #katandandre,gender,True,False,-0.636,True,False
"Meghan, what is despicable is folks who hear two people tell different versions and automatically agree with the one who says she was called a bitch. He denied that. But what is your take on the femake reporter who call female WH press secretary a bitch? Misogyny?",gender,True,False,-0.8466,True,False
@BlackOpal80 ...as soon as you follow enough known anti-feminists their block list activates and blocks you.  Possible she is unaware of me.,gender,True,False,-0.6808,True,False
"I just also have a problem with sexist men, homophobic men (especially ones who fetishize bisexual and lesbian women, but hate gay men), men who excuse rape ect. Which are who most of those tweets are about. I definitely don't HATE men, especially considering I'm straight",gender,True,False,-0.4393,True,False
"@BristolBen No, I don't think she's a bigot per se but blind to whatever she chooses not to believe...",gender,True,False,-0.5499,True,False
"Look, Schneider, we grasp the nature of your attitude toward females, women, when you call one a ""bitch"". You tipped us off to your hatred of females, women.",gender,True,False,-0.8402,True,False
"In greyhound racing they call a black female dog a ""Black Bitch"" . Makes Coon cheese seem pretty tame !",gender,True,False,-0.2244,True,False
"yeah so annoying how they're doing their jobs @Dean_Carr Call me sexist but woman football commentators annoy me so much, they never shut up",gender,True,False,-0.6424,True,False
RT @Joseph_MC3 I'm not sexist but it's extremely hard for me to listen to a female vocalist,gender,True,False,-0.2592,True,False
Women's bathrooms are so much worse than men's.  Everyone agrees. #fuckthanksgiving,gender,True,False,-0.3774,True,False
"Deprived of new women to hate in Toronto, A Voice for Menners resort to rape jokes, gay bashing http://wp.me/p17cYK-2Cj via @DavidFutrelle",gender,True,False,-0.8885,True,False
Precisely my point. I've been in both situations cos I socialise with guys In a way where they see me more like a dude than a chick so I can hear them talking about others using bastard/sob in a guy kinda way. Female version = war declaration when a girl calls another a bitch.,gender,True,False,-0.7102,True,False
"@DQTwitchStream ...if they hadn't just flushed their Cup chances, I'd be inclined to argue...",gender,True,False,-0.1531,True,False
The amount of times the men in my family refer to women as bitches and make rape jokes and gay jokes is I N S A N E.,gender,True,False,-0.765,True,False
"#scottbrown I against women's right to choose. Against gay rights. Basically a homophobeic, racist, sexist willing to even rape his opponent",gender,True,False,-0.8658,True,False
@Brittany_Blade: #FemFreeFriday because fems aren't actually doing anything for oppressed women in the Middle East. http://t.co/pUYim4Q8jk,gender,True,False,-0.4767,True,False
"RT @TheBoghdady: Can I cry now? I think I'll cry! This is exactly what women should look like! Thanks, @Mazloum! http://t.co/KyXNxTz1Zf",gender,True,False,-0.3971,True,False
RT @RichardMeal @sir_lummox maybe that's where they should focus? Less cunts on football. #notsexist,gender,True,True,-0.5584,True,True
"It's just like when females call each other ""bitch"" ...it's a reclaimed word ...but if a man calls them a bitch ..it's offensive...you don't get to use a word just to fit in. That's not how this works...it will be an offensive word to black people if you are white using it",gender,True,False,-0.8225,True,False
RT @musicshooter: Oh Shit. Now we have to put up with freaking Kat and No Balls Andre for another week. FMD.  #mkr,gender,True,False,-0.8225,True,False
But what if the female in question really is a bitch? Is it okay to call her one then?,gender,True,False,-0.6814,True,False
"As soon as a female get mad at a nigga, her favorite thing to call him is a ""stupid bitch"" I've witnessed it too many times",gender,True,False,-0.8126,True,False
"Females are weird, I will never call another bitch my friend or let alone sis. Im done tryna be a real friend to you whores. Y’all ungrateful.",gender,True,False,-0.0588,True,False
So @AWPromotions was fired for a rape joke but gay marriage was fine? Just another thing to make WWE suck more than it already does,gender,True,False,-0.7455,True,False
Uh have you ever heard conversations between men? All we do is name call and we learn at an early age to defend oneself. I think females are very protected at an early age and don’t experience that stuff. Being called a bitch at work is not okay but it’s not just a female thing.,gender,True,False,-0.1622,True,False
"You are awful. @TheOnlyJHarris WOMEN SHOULD NOT DO PLAY BY PLAY FOR MENS SPORTS!!!! IM NOT SEXIST, IT'S JUST FACT. THEY ARE AWFUL.",gender,True,False,-0.8098,True,False
Fuck off @julescarbonaro And call me sexist but females tryna b president.Just stop. There's a reason why it's called the founding FATHERS .,gender,True,False,-0.6187,True,False
TOO MANY RULES. FEMALES ARE BAD AT MATH. #ladylike http://t.co/lurGr17swx,gender,True,False,-0.6408,True,False
conservatives: lmao gays should fucking die conservatives: haha rape joke funnie conservatives: im going to light that muslim woman on fire conservatives: stop crying libtards its a joke this guy: im gonna stop old ppl from voting hahah- conservatives in the replies: https://twitter.com/TonyBeast1957/status/1234888411024121877,gender,True,False,-0.8036,True,False
"Everyone upset about Amy Schumer's gay jokes seems to have forgotten she made rape jokes too. As in, she admitted to raping a guy and then did a bit about it. Soooo... yeah. She's trash now and always has been and I hate how quickly everyone forgets things.",gender,True,False,-0.9201,True,False
"RT @KurtBelcher I'm not sexist, but this is one seriously stupid bitch. http://t.co/qR2dPRL2qi",gender,True,False,-0.9161,True,False
RT @Deski1701 I'm no sexist but I hate how girls are ALWAYS made out to be the victims,gender,True,False,-0.8625,True,False
RT @livebylove29: @YesYoureSexist Was informed by a man today that there's no difference between Michigan's Rape Insurance and his house an…,gender,True,False,-0.7845,True,False
"RT @TehMenz: #QuestionsForMen Did you know that scientists agree that women ""slut shame"" to make vaginas more valuable to you? http://t.co/…",gender,True,False,-0.2516,True,False
@RepTedYoho &lt;-- this guy had the NERVE to call a female constituent a fucking bitch!,gender,True,False,-0.6581,True,False
"@Yellow0531_ ha nigga get some new jokes , lol bitch ima send reshawn gay ass on you too rape you lol Iheard you like to take it in the butt",gender,True,False,-0.3612,True,False
Because of fucking inane male opinions like this one. @hectasticcc Why are girls just mad at the world for no reason? #notsexist,gender,True,False,-0.4404,True,False
It’s so amazing that a reporter calls the White House press secretary a lieing bitch and no one is up in arms over it and it was a female reporter who said it to by the way but her organization didn’t say or do anything about it.,gender,True,False,-0.1163,True,False
"I don’t let anyone else call any female I’m with a bitch, so why would I use it to describe the mother of my child.",gender,True,False,-0.5859,True,False
"@RepTedYoho Do you really not have a better way to express an opposing opinion than to call a female Congresswoman a fucking bitch?? Weak-ass Ad Hominem, motherfucker.",gender,True,False,-0.9092,True,False
What if she was being a bitch? Why does her being female give her a free pass for any form or scrutiny or verbal lashing? I'd happily call a man or women a bitch/prick if they was acting up.. fuck this world mun people want to be offended for others so much now,gender,True,False,-0.3527,True,False
"#mkr was not a fan of the promo girls, but Kat is worse !",gender,True,False,-0.7116,True,False
"Im about to cry im in class rn and my prof keep on making rape jokes, invalidating the lgbtq folks and sexualizing gays and lesbian.. im sitting here about to fucking cry bc ive never been offended so bad.",gender,True,False,-0.9318,True,False
 cancel that bitch like Nino ,gender,True,False,-0.5106,True,False
"Is the joke here that he's gay, or that prison rape is funny?",gender,True,False,-0.5994,True,False
"Men ""have a discussion."" Women ""argue.""",gender,True,False,-0.34,True,False
RT @hollowmaniac: Indian woman (27) who burned husband to death after luring him into a bathtub for massage found NOT GUILTY of capital mur…,gender,True,False,-0.256,True,False
Female: you cant call me a bitch! Her bio: im that bitch Me:,gender,True,False,-0.8356,True,False
@nat_com1 @Feminazi_Front Men are physically stronger. Women gestate babies. Pointless for any1 to whine that this denies them equal rights,gender,True,False,-0.4019,True,False
"RT @SteelThunder13: The Friendzone doesn't exist. There is a ""Women exploit you for your Feelings"" Zone.",gender,True,False,-0.1027,True,False
"It's exactly that! Some men would refer to women as ""bitches"" when we said just call us women they switched to ""females"" as if calling us women while calling themselves men was so difficult. an ex guy friend actually got mad at me for asking him to use my name instead of bitch.",gender,True,False,-0.9049,True,False
"To channel every right wing thug who’s ever mocked a gay man in the street, thrown bananas at a black footballer, or told a woman he wouldn’t bother to rape her... Can’t he take a joke?",gender,True,False,-0.802,True,False
"Being gay doesn't make it okay to tell a girl you're gonna rape her 'as a joke'. Rape has never been about sex, but about power.",gender,True,False,-0.6633,True,False
"When a female call u a bitch like that.. u know u a real sucka, shorty said really bitch? Lol",gender,True,False,-0.513,True,False
"I actually had to throw my two cents in on a prison rape joke not being funny. (and for the record: I'm gay, and I seek the small penised, so there!....they are desired. )",gender,True,False,-0.7983,True,False
Why is #BlameOneNotAll repugnant? Because it allows for cis het male oppressors to cast single blame elsewhere when they too are complicit.,gender,True,False,-0.34,True,False
"+ additionally these actors are openly HOMOPHOBIC, Mysoginists, who make jokes about RAPE, and who looks down on people with MENTAL ILLNESS. Also, the fact that you villainize women on your series isn't helping at all. You don't need to drag women to portray gay relationships ++",gender,True,False,-0.8437,True,False
if you’re a man & i call you a bitch. i meant that shit.. you must be acting like a female. ion like that,gender,True,False,-0.5267,True,False
"RT @FO7935: If you're a grown woman who hasn't gotten past your awkward teenage years of confusion and angst, you're probably a feminist",gender,True,False,-0.4215,True,False
"Okay, It really rubs me the wrong way when females try to call me girl or sis. Bitch stop playing with me. This not that.",gender,True,False,-0.7506,True,False
Girls should NOT care about your opinion. @that_ashton_kid Girls should NOT participate in no shave November,gender,True,False,-0.1877,True,False
Did she get abducted by aliens while you were getting rape by a gay frog because pizza gate took your kids away for being a human joke??,gender,True,False,-0.7998,True,False
Get a grip @Tee_Reel: Im not sexist but my dentist is a Woman because I don't feel comfortable with a guy sticking his hands in my mouth.LOL,gender,True,False,-0.5504,True,False
RT @ExclusiveGinger I'm not sexist but most girls = bad drivers,gender,True,False,-0.7307,True,False
I'm not worried about a bitch that live with her mother you can't even get a place in your name you got rules stay in a child's place #COON,gender,True,False,-0.4427,True,False
@GOP @WhiteHouse Is this now the Republican culture? Trump gutter speak? Now it's ok to call a female public officials a fucking bitch? This is what you have let lead our country. https://nbcnews.to/3fVGXTn #ShameOnYou #Metoo #sexistbullying @ProjectLincoln @CNN,gender,True,False,-0.5319,True,False
"RT @__DEEsire__: ""you mad bitch ?""Ã°ÂÂ¤Â ""stay mad !"" Ã°ÂÂÂÃ°ÂÂÂ https://t.co/J6TRKy4aAK",gender,True,False,-0.8883,True,False
Oh Kat you do something new every night to make yourself look even more like a hateful twat! #mkr #karmaisabitch,gender,True,False,-0.7478,True,False
"No, one mistake should not bring down a politician who clearly is not serial sexist Don't hear women call for resignations when GOP calls for death to gay men RT Perspective | I'm a feminist. I study rape culture. And I don't want Al Franken to resign. http://wapo.st/2hyL9Mo?tid=ss_tw&amp;utm_term=.2e673d605a9b",gender,True,False,-0.9205,True,False
"They probably meant ""im gay for her"" as a joke..alot of people say that when they really admire someone &amp; the rape allegations were proven false in many areas.",gender,True,False,-0.3197,True,False
"On rape jokes, racist jokes, gay jokes, transphobic jokes, terrorist jokes etc: ""It's not just a joke or a phrase, it's a very violent and traumatizing thing for survivors"" - The @MacEwan_OSVPE panel on Linguistic Violence #AtTheRoot #MacEwanU #NoPlaceHere – at MacEwan University",gender,True,False,-0.9688,True,False
"@Barnflake ""I'm not sexist, it just so happens that I only complain about quality when it's women playing, ignoring all historical context.""",gender,True,False,-0.5267,True,False
"Anyone else as disgusted as I am? Rape is not a joke; it is not a false accusation to make to further your political agenda. Oh! And by the way, gay people aren’t inherently rapists or pedophiles. These men should be ashamed.",gender,True,False,-0.9512,True,False
