tweet_text,cyberbullying_type,is_targeting_women,needs_review,sentiment_score,is_hostile_to_women,is_hostile_needs_review
rape is real..zvasiyana nema jokes about being drunk or being gay or being lesbian...rape is not ones choice or wish..thtz where the sensitivity is coming from,gender,True,False,-0.7269,True,False
"@coiny Also, it's hard to take a company seriously re: harassment when the game has rape jokes &amp; gay jokes and treats women the way it does.",gender,True,False,-0.8074,True,False
So I call you female I’m basically calling you a bitch ?,gender,True,False,-0.5859,True,False
I know the worst feeling for a female gotta be when they break a nail I can just tell that shit hurt like a bitch,gender,True,False,-0.9169,True,False
"“We voted for a guy who said he’d rather have a dead son than a gay one, claimed POC weren’t ‘even good for procreation anymore’, &amp; told a female politician the only reason he wouldn’t rape her was bc she was ugly, but please don’t think we’re sexist, homophobic, or racist.”",gender,True,False,-0.4118,True,False
"I always get fucking pissed when I see a man joke about the sexual abuse of another man. “Wow. Please she should come &amp; rape me too, some of us want.” “Mans is complaining. Nigga you gay? ” What foolishness, mocking and minimizing someone's pain for bants. Are you okay at all?",gender,True,False,-0.9636,True,False
"@DrawPlayDave ""Nuke the gays"" is one of those ""ha ha no but really"" jokes. Whereas no one is actually pushing an agenda of child rape.",gender,True,False,-0.8274,True,False
RT @BudLightBro FUCK. I'm not sexist but I have a girl in my recruit school AGAIN. Son of a bitch.,gender,True,False,-0.8324,True,False
"almost 2017 & yall still out here using gay as an insult, making rape jokes, &amp; degrading women bc of their sexual history?? thats gotta go.",gender,True,False,-0.9034,True,False
I'm annoyed to have missed this live. Need some bitchy. #mkr2015 #mykitchenrules #mkr,gender,True,False,-0.7964,True,False
I call people bitches all the time. Male and female. Why did he call her one?,gender,True,False,-0.5994,True,False
"Cant call her a bitch, cause a bitch is a female dog, and female dogs are loyal, which these hoes are not.",gender,True,False,-0.6705,True,False
Im mad he didn't hit that bitch ! https://t.co/7sJtfx1SFy,gender,True,False,-0.1078,True,False
were there no women on the ships? just gays? is that that why he loves rape jokes so much? doubt it.,gender,True,False,-0.6724,True,False
"When they speak its a dick joke, ""that's what she said huehuehue"", calling some gay/faggot, making rape/sexist/racist/homophobic comments",gender,True,False,-0.2732,True,False
from what people have said there are rape jokes and the gay characters are made into a joke so. hopefully thats as bad as it gets,gender,True,False,-0.5106,True,False
Hate when niggas say “females” fuckin annoying bitch call me a woman or don’t say nun at all,gender,True,False,-0.9212,True,False
"The whole punching up/down is not ok because it mocks the powerless for getting the short end of the stick in a system in which the powerful actively works to keep in place and benefits from. That makes sense to me. The rape jokes, gay jokes, Trans jokes all fall in here.",gender,True,False,-0.2705,True,False
"RT @sara771987: @adriennecgomez @MT8_9 there's too many people with common sense, sorry. We don't need to rely on feminism to bring about e…",gender,True,False,-0.0772,True,False
 Keeks is a bitch she curves everyone  lol I walked into a conversation like this. Smh,gender,True,False,-0.2789,True,False
"What is a female? female what? Female dog, female cat? Female is usually used to describe the sex of an animal. Female is an adjective not a noun. We don’t call men males. It’s disrespectful and just another way to say bitch. We are women or ladies not females.",gender,True,False,-0.6531,True,False
"Anybody else bothered that our president would rather make rape jokes, or talk about being cured of being gay, rather than make any kind of statement on how Filipino fishermen were rammed &amp; abandoned at sea by a Chinese ship?",gender,True,False,-0.8402,True,False
Men know sexism when they hear it. They appreciate it when they homeboy call them a dog but feel disrespected when they are called a bitch. Both mean dog but one specifies a female. It’s being compared to a female that is disrespectful because that is associated with being weak.,gender,True,False,-0.9217,True,False
"Hey, you can message @reptedyoho on Instagram and tell him how rude it is to call his female colleagues ""fucking bitch"".",gender,True,False,-0.796,True,False
What the hell is this recurring weirdness @janicewidit I swear I'm not sexist but female chipotle employees can't roll burritos for shiizzzz,gender,True,False,-0.5187,True,False
Can't call my female dog 'bitch' even if its what she literally is,gender,True,False,-0.5859,True,False
"people should not have to be afraid of being gay. people should not have to fear disownment, conversion therapy, corrective rape, and murder for their sexual orientation. they also shouldn’t have to worry about tone deaf heteros whining about gay jokes on twitter, but here we are",gender,True,False,-0.699,True,False
RT @Lizzethismetal: Probably gonna piss off some #feminists,gender,True,False,-0.4019,True,False
@RepTedYoho Hey dipshit do you feel like a BIG man when you call a female colleague a fucking bitch? Maybe your tighty whities are a little too right and scrawny little balls are all bunched up - if you have any that is #dipshit #asshole #chauvenistpig #RepublicanAsshole #resign,gender,True,False,-0.8805,True,False
"#WaysToMakeMeMad Continuously joke about rape, genocide, gay rights, or any other type of human rights related topic as if it doesn't matter",gender,True,False,-0.5535,True,False
"-TW- My aunt's boyfriend showed up to Thanksgiving dinner in a Trump 2020 shirt. He also made gay &amp; rape jokes with my ""grandfather"" at the dinner table. In front of me, my mother (the host), sisters, &amp; 7 year old baby brother. As if today isn't hard enough. Yay holidays.",gender,True,False,-0.5544,True,False
RT @Hector_newcomb: I am not sexist but changing making the next Thor female isn't something I'm okay with due to Thor almost always being …,gender,True,False,-0.2498,True,False
Females got the audacity to call niggas ugly but all we got is hair cuts and a lineup y’all beat ya face with makeup to be a whole different bitch,gender,True,False,-0.8968,True,False
"First line: -""why boys crack up at rape jokes"" -implies that all boys find rape hilarious. No disagreement from you there, John? -""...think having a girlfriend is gay"" -implies that boys believe this, based on... what exactly? News to me. Do you agree that boys think this?",gender,True,True,-0.5618,True,True
RT @Jordan_Atkinson That woman reporter on Soccer Saturday hasn't got a clue #annoying #notsexist #thetruth,gender,True,False,-0.4019,True,False
"@NurseLoco exactly! He was also making jokes about self harm, suicide, rape and said there's a special place in hell for gays... NOT OK!!!",gender,True,False,-0.9499,True,False
RT @PoliticalCynic: Instead of doing something about the feminists who hate men I'm going to scream at you for pointing them out. #TweetLik…,gender,True,False,-0.7506,True,False
"And yet if a woman should ""not mince words"" you'd call her a bitch if it didn't align with your opinion. I find him offensively bigoted. All Rah Rah America, as it fails a good portion of the population: the poor, the brown, the female, the LGBTQ, immigrants....#BeBest",gender,True,False,-0.891,True,False
"I posted about a problematic drag queen that made a rape joke at Queer Junction in Sheffield &amp; the terrible customer service that followed by someone working for them who also maliciously misgendered me &amp; said that I ‘shun the gay world’ - what a way to run a business, huh?",gender,True,False,-0.886,True,False
"said the n word multiple times during her live stream, supposedly called wyatt gay when she tried to “insult” him, made rape jokes, then she said that we’re mad because she’s dating our “crush” which is absolute bullshit lmao",gender,True,False,-0.7783,True,False
"RT @BlackMilk_69x: Gotta bad bitch and she can't keep her clothes on so I'm like bend over, stop and strike that pose https://t.co/zPKF3WFxâ¦",gender,True,False,-0.8032,True,False
Milo isn’t libertarian. He did and interview with your golden boy nick and they both hate libertarians .Joe Rohan has a huge following and doesn’t make rape jokes or talk about taking a woman’s right away to vote. He also doesn’t make fun of gay veterans.,gender,True,False,-0.2023,True,False
"RT @WRCorg: UCLA Women's Law Group Libels CHS, Then Tries to Hide it. #womenagainstfeminism http://t.co/NFqIgwK88y",gender,True,False,-0.1779,True,False
"@JustinAkehurst @f1eetfox But also it hasn't hurt her career either and doing rape, trans, gay and fat shaming jokes should have.",gender,True,False,-0.3369,True,False
RT @jacobselvey Call me sexist but if it's a female rapping I automatically dislike the song. #Chauvinism #VocabWord,gender,True,False,-0.5267,True,False
"nothing says sexy like rape jokes, fatphobia, gay stereotypes and sexualizing lesbians for male consumption. the fact that he's fucking ugly doesn't help either lmao",gender,True,False,-0.9505,True,False
@RepTedYoho half heartedly 'apologized' to Rep Ocasio-Cortez for calling her a fu@king bitch. He has 2 daughters and yet he blatantly uses vulgar language wrt a fellow female Rep. Being a Repub. I am sure he goes to church on Sundays and I wonder whether what he calls Mary?,gender,True,False,-0.0516,True,False
"Make jokes about rape, make jokes about paedophilia, make racist jokes. Yeah you're definitely fighting for the right side. It's not like there's video evidence of Vic being lovinhf and kind to the gay and trans community to disprove his Homophobic accusations.. Oh wist, there is",gender,True,False,-0.5122,True,False
"so far, the men in credit have called me dumb, mocked gay people, said women shouldn't have equal rights, and made jokes about rape victims.",gender,True,False,-0.8402,True,False
rape isnt a joke.. girls are human too so thats why for me gay is good,gender,True,False,-0.5702,True,False
- A Misogynist @parody_guy A woman wants her man to treat her like a princess to the world and fuck her like a whore. - Someone,gender,True,False,-0.2732,True,False
"She has made gay, rape and race based jokes. Just in the first two episodes of her show. She’s not funny at all she’s just slightly weird and politically incorrect. The very definition of white feminism and she’s so basic.",gender,True,False,-0.7589,True,False
"exactly but people hate when female characters have unhealthy coping mechanisms because of trauma so they'll just call her a ""bitch"" or say she's rude for no reason",gender,True,False,-0.9806,True,False
"You ""consider"" yourself as part of this community and you think like that motherfucking way? RAPE JOKE IS A NO LAUGHING MATTER! AND SAYING THAT GAYS WHO GET RAPPED WOULD FEEL HAPPY PA? ANONG UTAK MERON KA GIRL TANGINA MO",gender,True,False,-0.7858,True,False
"Retweeted Avi (@AviAhvee): Just gonna keep a running list of things I wish people would stop doing: 1) mocking women based on their appearance 2) making prison rape ""jokes"" 3) making ""jokes"" about people being gay... https://www.facebook.com/1350722369/posts/10212536304226521/",gender,True,False,-0.802,True,False
"RT @LiamDangerSmith: Call me sexist, but I really don't like female country singers",gender,True,False,-0.4736,True,False
"Men are empowered to call female politicians a ""fucking bitch"" when women speak of them hatefully and other women do nothing.",gender,True,False,-0.8122,True,False
"Remember when Vince Vaughn's own director said he regrets the movie that made Vince Vaughn famous because of date rape jokes, ""sassy"" racist grandmother tropes and gay men as predators?",gender,True,False,-0.8807,True,False
"Self described ""radical feminist"" makes death threats against #GamerGate WOC for not doing/thinking as she was told. http://t.co/sVXfPPIhef",gender,True,False,-0.7717,True,False
"RT @chriske17370944 I'm not sexist but the new Ghost Busters with an all woman cast, nah, won't be the same tbh #Ghostbusters",gender,True,False,-0.5499,True,False
Y’all: “HaHa drunk pussy the best pussy” “wHeN sHe ThInk ShE OnLy CoMiNG to SmOkE” “I WaNnA gEt a BiTCh DrUNk Ykwtfgo” “id RaPe A BiTCh NaSty” “id let my son get raped by women before he can ever admit he’s gay” Y’all: oMg yALL sOfT iSsA jOkE,gender,True,False,-0.9382,True,False
"Last time I checked, anal sex wasn't exclusive to gay men. Prison rape has nothing to do with homosexuality. It's unfortunate that a type of sexual act has been conflated with sexual preference... why reinforce that? That said, not defending jokes about rape here.",gender,True,False,-0.9572,True,False
"Suck shit Kat you vile, venomous, nasty bitch! Giving shit to Annie and Lloyd, only to be told your dish was gross! Karma Bitch! #MKR",gender,True,False,-0.9817,True,False
.@trishesdishes Can you be legally forced into parental obligations?  Can your genitals be cut at birth?  Does your right to vote have an *?,gender,True,False,-0.6416,True,False
"Yoho Ousted From Christian Charity Board After ‘Verbal Attack’ On AOC You mean it's not Christian to call a young female colleague a ""fucking bitch""? Who'd a thunkit?",gender,True,False,-0.3925,True,False
"Today’s society so sensitive it’s sad they joke about everything but they take out the gay jokes before race, rape, and other “sensitive” jokes",gender,True,False,-0.6288,True,False
RT @_queenshnir: bitches be boosie bad ass until it time to fight. then they a no showÃ°ÂÂÂ´,gender,True,False,-0.8658,True,False
I'll still call them females. And Bitches too.,gender,True,False,-0.5994,True,False
"RT @_scottelder: @charMANdork @TheRealFTA I'm not sexist, but women are inferior. proving that you can still be an idiot regardless of your…",gender,True,False,-0.8402,True,False
Mind you it was because she made a rape joke about a 17 yr old girl and I called her out on it but then she said it doesn’t even matter cause she’s gay anyway. And then called me stupid. Goodnight y’all,gender,True,False,-0.7717,True,False
"You call Yoho’s remarks “criticism?” Whatever happened to civil discourse? Is it ok for a man to call a female colleague a fucking bitch? Name-calling by Republicans has got to stop, not to mention name-calling by men against women. Our president has lowered the bar way too far.",gender,True,False,-0.7297,True,False
@HeatherMoAndCo @Shermertron Mary Koss.  Seriously...,gender,True,False,-0.1779,True,False
"@RepTedYoho , your disgusting display of gaslighting and while male fragility will live on in the arhives of herstory. And how dare you pull the ""long marriage two daughters"" gag to absolve you your choice to call a female colleague a fucking bitch. YOU are the BITCH, sir.",gender,True,False,-0.9221,True,False
"So saying bad things about women is harassment, saying bad things about gay people is an opinion/joke? Okay. BTW, the men who “joke” that you should be able to rape a woman to keep her in line (a common fun thing they tweet a lot) also say it’s just their “opinion.”",gender,True,False,-0.9058,True,False
"he beat women and a gay man almost to death. he tried to kill and rape his girlfriend with a pitchfork. dumb kpop jokes are the very LEAST of what he deserves. he doesn’t need anyone to defend his EVIL, misogynistic, homophobic, rapist ass but thanks anyway https://twitter.com/valentaevibes/status/1008839625027268608",gender,True,True,-0.9017,True,True
"RT @GalenHerron I'm not sexist at all, but I do hold the firm belief that girls/women shouldn't be allowed to drive. No need to explain why",gender,True,False,-0.4215,True,False
&#128514;&#128514;&#128514;&#128514;&#128514;&#128514;&#128514;&#128514;&#128514;&#128514;@DaHomieFuzz: Gay niggas couldn't wait to act like bitches tonight,gender,True,False,-0.5859,True,False
"reasons i hate the guys in my grade: they joke about the disabled, rape, other races, women, gay people, literally everything you shouldn’t joke about- i mean i like my school and all but southern christian conservatives immature high school guys are just a LITTLE TOO MUCH for me",gender,True,False,-0.3071,True,False
"@SarahBMaslow_RC It kinda was tho:/, + if it was a girl who bullied you, why would you be like ""stop bitching to my friend, yeah? after (c)",gender,True,False,-0.128,True,False
I understand totally. The idea of telling my son he's not allowed to call his female colleagues fucking bitches is just filling me with absolute horror,gender,True,False,-0.8357,True,False
@drimranqamar She is lying.,gender,True,False,-0.5267,True,False
Corbynites made the Starmer bros call female workers bitch face cow &amp; plot to throw darts at her face?,gender,True,False,-0.5859,True,False
@paddy_muldoon A male calling a women who is sticking up for gays and rape victims sexist. That's rich.,gender,True,False,-0.5267,True,False
RT @davidalice Why are LA women so bitchy? #notsexist,gender,True,False,-0.6418,True,False
"RT @pay_pay247 I'm not sexist, but women's basketball makes me want to puke",gender,True,False,-0.631,True,False
"Yes, you are. @KenBest I swear I'm not sexist but watching girls basketball usually makes me want to shoot myself in the head",gender,True,False,-0.2263,True,False
a little girl saying nigga in a song and calling someone gay as a fuckin joke and APPARENTLY making a rape joke. Headass,gender,True,False,-0.2516,True,False
Notice how the argument isn’t “don’t call a man a male.” They’re trying to say that men secretly call women “females” as a pejorative in lieu of “bitch.” Yeaaaaahhhh...ok!,gender,True,False,-0.4199,True,False
"Female is diet bitch for sure, but is not ok to call someone a bitch if they’re acting like a bitch. Is that not acceptable?",gender,True,False,-0.9284,True,False
Sassy? Gurls you ain't sassy. More like bitchy. #MKR,gender,True,False,-0.71,True,False
females really be getting annoyed when they man spams them with texts and calls welll shittt you wanted a man to do all that cute shit with right ungrateful bitches goodnight,gender,True,False,-0.885,True,False
"RT @milkyway40: I'm not sexist, but female sports announcers annoy me.",gender,True,False,-0.5927,True,False
this fucking girl in front of me joking about people being gay and rape. Seriously not something to joke about,gender,True,False,-0.7497,True,False
"I suppose Kat thinks it's ""unfair"" like every other time her 'yuck food' has been given bad critique?Shes like a child! Stop bitching! 😤#mkr",gender,True,False,-0.7568,True,False
RT @dylan_w_wilson Go ahead and call me sexist but I do not trust girls in a gun store.,gender,True,False,-0.7686,True,False
"Heads up to others who live in upstate NY the Roma's in Latham NY has a bunch of assholes working in it. They have been making racist comments about their black customers, make up rape jokes about female employees and customers, and frequently take about how trans, gay, and-",gender,True,False,-0.91,True,False
Stupid bitch ðððð you so trifling https://t.co/4WGUuNdwMZ,gender,True,False,-0.802,True,False
"You think it's in order for a congressman to go up to his female college and call her a ""fucking bitch because they differ on policy?"" That's what your ""spirit-filled"" Christianity prescribes?",gender,True,False,-0.6655,True,False
Men lack such self-awareness @3umarzF Women are so complicated. #NotSexist,gender,True,False,-0.3182,True,False
"RAPE JOKES WILL NEVER BE FUNNY OK?? EVEN THOUGH THE ""JOKE"" U MADE WAS FOR GAY PPL JUST KNOW THAT RAPE WILL NEVER EVER BE FUNNY WHETHER THE VICTIM IS STRAIGHT OR NOT HA???? KAYA FUCK U NLNG SA GROUPMATE KO WHO MADE A FUCKING RAPE ""JOKE"" SA SCRIPT NAMIN",gender,True,False,-0.9305,True,False
"Sexism is still not acceptable even if you throw ""white"" in front of ""woman"" Homophobia is still not acceptable if you thow ""white"" in front of ""gay"" Rape jokes &amp; body shaming are still not acceptable if they're directed to men. Being a minority doesn't excuse bigotry.",gender,True,False,-0.832,True,False
"tw // abuse, sexual abuse, homophobia, m*geko m*geko fully made a gay ship that was abusive (physically, mentally AND sexually) turned it into a joke, gave them a child and then made that child not only have a gross love for their father but also????? straight up rape him????",gender,True,False,-0.9154,True,False
@g56yu @JillFilipovic @rsmccain @ShunCampusWomen There's a difference between a feminist and a feminazi. Fools call the latter the former.,gender,True,False,-0.4939,True,False
"How come I hear more about Breast Cancer, Than Prostate Cancer, How Come I hear More about Female Depression than Male Depression. If I post on my stories a pic of me crying they would call me a Bitch, if a girl does it everyone goes to ask them if they're ok.",gender,True,False,-0.9767,True,False
"as someone who lives with a man who believes he can’t be sexist because he’s gay but who will still mansplain to me my own career, degree, experience with female healthcare and say rape culture is a myth- I agree wholeheartedly",gender,True,False,-0.6486,True,False
"You can either choose to host a fascist who is perpetuating brutal state violence against Indigenous people & Afro-Brazilians, who jokes about rape, and who has nothing but contempt for women, trans people, &amp; gay people, or you can NOT. Your choice is clear &amp; we won’t forget.",gender,True,False,-0.3802,True,False
"Just let some ""dude"" walk past your mom and sister and call them ""fucking bitches"". Don't care if your mom and sis are whiners or any of that, just because they're women and most men are threatened by strong females. AOC called it for us- women",gender,True,False,-0.8247,True,False
@LickHerNoChaser @MrMacAsshole what's up with you and the gay jokes lately?? Did somebody butt rape you smh,gender,True,False,-0.7476,True,False
RT @ImAnotherVoice: @Dezzantibus @MT8_9 @theesadiemarie and we still get payed equally. That stupid myth bothers me to no end because there…,gender,True,False,-0.7506,True,False
Some of you girls think being a bad bitch is all there is in life,gender,True,False,-0.8074,True,False
Why niggas call females a bitch when they get rejected lol,gender,True,False,-0.7717,True,False
"She not actually going to rape anyone it was just a joke lol stop being so up tight. Now I feel like you might be under 18 huh? From my experience tho, all gays talk different, some are overally sexual.",gender,True,False,-0.1027,True,False
No way that's sexist at all! @Abdul_a95 I'm not sexist but female characters in TV shows are 99% usually the most annoying character,gender,True,False,-0.7079,True,False
"The Miseducation of the American Boy Why boys crack up at rape jokes, think having a girlfriend is “gay,” and still can’t cry—and why we need to give them new and better models of masculinity",gender,True,True,-0.2023,True,True
"yeah, probs. “female” just feels so dehumanizing. that and female doesnt fit grammatically in some sentences and it’s like at that point just call me a bitch to avoid sounding dumb",gender,True,False,-0.8974,True,False
RT @ex_feminist: #questionsforfeminists For those of you that think it isn't socially acceptable to abuse men.. It is. http://t.co/AZ6Dx8UW…,gender,True,False,-0.7321,True,False
RT @_queenshnir: bitches be boosie bad ass until it time to fight. then they a no showð´,gender,True,False,-0.8658,True,False
"My sister told her ex that she hopes he meets a bad bitch, fucks her, and then finds out it's the mom he never knew.",gender,True,False,-0.8225,True,False
Because they want to be a mother and maid to some loser @ThoughtCatalog 7 Reasons Girls Should Date A Nice Guy http://t.co/p2t9aLs5YX,gender,True,False,-0.0772,True,False
@Gay_Actuality @Avocate How dare you make jokes of rape! I was raped by my father at 5 yrs old. Then he passed me off to a priest at age 8!,gender,True,False,-0.8715,True,False
I totally get this is a joke and its hilarious but I'd also like add that this was clearly made in a time when the only way to be gay was to rape and violate one another. Tell me thats not more perverse,gender,True,False,-0.0713,True,False
"We spending less money than you females.Y’all spending so much on makeup and wardrobe just for the gram, and no doubt y’all got the same type of LES lights, and we don’t call females “bitches” out here, that just mad disrespectful.Point is gaming setup won’t waste our time and",gender,True,False,-0.598,True,False
RT @LeviathanPride Do men pretend to give birth? No? Then women should stop pretending to make a difference in politics.,gender,True,False,-0.3736,True,False
"Black folks was making racist jokes, everyone was making offense gay jokes, virtually no respect for rape cases anywhere",gender,True,False,-0.8821,True,False
"Some gals let their man call them ""my bitch"" but ready for war when they see the word female on the tl",gender,True,False,-0.6705,True,False
@talisasofie Feminists think hating men is feminism.,gender,True,False,-0.5106,True,False
*Insert San Francisco gay rape joke here*,gender,True,False,-0.5423,True,False
This is the probably the committee that decides who sells oil to the world. They just gave it a sexier name. 3/4 of these places toss gay people off the tallest building in sight and throw rocks at women for being victim of rape. What a sad joke.,gender,True,False,-0.8271,True,False
